<?xml version="1.0"?>
<!DOCTYPE TestInterface SYSTEM "../../../shared/dtd/Tif.dtd">
<TestInterface version="1.0">
 	<Board name="common">
		<Device name="System" path="/system" comment="System information">

			<Variable name="Version" type="STRING" access="read-only" comment="Shows the application version string" />
			<Variable name="Build" type="INT" access="read-only" comment="Shows the build number" />
			<Variable name="Customer" type="STRING" access="read-only" comment="Shows the build customer string" />
			<Variable name="Application" type="STRING" access="read-only" comment="Shows the build application string" />
			<Variable name="Board" type="STRING" access="read-only" comment="Shows the build board string" />
			<Variable name="Duplex" type="STRING" access="read-only" comment="Shows the build duplex string" />
			<Variable name="FibreInterface" type="STRING" access="read-only" comment="Shows the build fibre interface string" />
            <Variable name="CurrentFpgaBuild" type="INT" access="read-only" comment="Shows the FPGA build number of the currently fitted FPGA" />
            <Variable name="FpgaPart" type="STRING" access="read-only" comment="Shows the FPGA part number the software was built with" />
            <Variable name="FpgaBuild" type="STRING" access="read-only" comment="Shows the FPGA build number the software was built with" />
            <Variable name="HwId" type="STRING" access="read-only" comment="Shows the hardware identification of the system" />
            <Variable name="HwRev" type="STRING" access="read-only" comment="Shows the hardware revision of the system" />

            <Function name="getBoardId" comment="Return the radio card board identification">
                <Return>
                    <Data type="INT">BoardID</Data>
                </Return>
            </Function>
			<Function name="services" comment="Allows all application services to be temporarily suspended and resumed">
                <Args>
                    <Data type="ENUM(suspend:resume)" comment="Request that all services are suspended or resumed">control</Data>
                </Args>
			</Function>

            <Function name="reboot" comment="Reboot the board" />
            
<!--
Removed from config.h - could be restored by creating a standalone file that the application reads in
 
            <Function name="gitVersions" comment="Show the git versions for this build" />
 -->
 
            <Function name="getSerialNumber" comment="Gets the serial number">
                <Return>
                    <Data type="STRING" comment="Serial Number">result</Data>
                </Return>
            </Function>

			<Function name="getHwBoardSerialNumber" comment="Gets the serial number">
				<Return>
					<Data type="STRING" comment="Hardware Board Serial Number">result</Data>
				</Return>
			</Function>
            
			<Function name="getHostName" comment="Gets the host name">

                <Return>
                    <Data type="STRING" comment="Host Name">result</Data>
                </Return>
            </Function>
            
            <Function name="getProductCode" comment="Gets the product code">
                <Return>
                    <Data type="STRING" comment="Product Number">result</Data>
                </Return>
            </Function>
            
            <Function name="showTasks" comment="Show task list" />
            <Function name="showLimits" comment="Show list of radio limits" />

            <Function name="getLimits" comment="Get list of radio limits" >
                <Return>
                    <Data type="INT" comment="Number of TX ports">numTx</Data>
                    <Data type="INT" comment="Number of RX ports">numRx</Data>
                    <Data type="INT" comment="Number of carriers">numCarriers</Data>
                    <Data type="INT" comment="Number of fibre ports">numFibres</Data>
                    <Data type="FLOAT[]" units="dB" comment="Min output power for each TX port">minPower</Data>
                    <Data type="FLOAT[]" units="dB" comment="Max output power for each TX port">maxPower</Data>
                    <Data type="FLOAT" units="kHz" comment="Min TX frequency">minTxFreq</Data>
                    <Data type="FLOAT" units="kHz" comment="Max TX frequency">maxTxFreq</Data>
                    <Data type="FLOAT" units="kHz" comment="Min RX frequency">minRxFreq</Data>
                    <Data type="FLOAT" units="kHz" comment="Max RX frequency">maxRxFreq</Data>
                </Return>
            </Function>

            <Function name="getSupplyVoltage" comment="Return the radio main supply voltage">
                <Return>
                    <Data type="FLOAT">value</Data>
                </Return>
            </Function>

			<Function name="getTemperature" comment="Retrieves the FPGA temperature">
			   <Return>
                    <Data type="FLOAT" units="DegC" comment="Temperature in Degrees Centigrade ">temperature</Data>
               </Return>
            </Function>

			<Function name="getState" comment="Show the application state">
			   <Return>
                    <Data type="ENUM(INITIALISING:STABLE:FAILED)" comment="Shows whether the application has reached the stable point or not">appState</Data>
               </Return>
            </Function>          
            
            <Function name="getDuplex" comment="Get duplex setting">        
                <Return>
                    <Data type="STRING" comment="Return the duplex setting">duplex</Data>
                </Return>
            </Function> 

            <Function name="setDateTime" comment="Sets the radio date and time in the form YYYY-MM-DD hh:mm:ss">
                <Args>
                    <Data type="STRING" comment="Date in the form YYYY-MM-DD">date</Data>
                    <Data type="STRING" comment="Time in the form hh:mm:ss">time</Data>
                </Args>
            </Function>
            
            <Function name="getDateTime" comment="Gets the radio date and time in the form YYYY-MM-DD hh:mm:ss">        
                <Return>
                    <Data type="STRING" comment="Date/Time in the form YYYY-MM-DD hh:mm:ss">dateTime</Data>
                </Return>
            </Function> 

		</Device>

	</Board>
</TestInterface>
