<?xml version="1.0"?>
<!DOCTYPE TestInterface SYSTEM "../../../../../shared/dtd/Tif.dtd">
<TestInterface version="1.0">
	<Board name="Helper">
		<Device name="Fpga" path="/fpga" comment="FPGA device">
			<xinclude:include href="../../../../../helper/common/xml/Fpga.xml#read"/>
			<xinclude:include href="../../../../../helper/common/xml/Fpga.xml#write"/>
			<xinclude:include href="../../../../../helper/common/xml/Fpga.xml#monitor"/>
			<xinclude:include href="../../../../../helper/common/xml/Fpga.xml#monitorShow"/>
			<xinclude:include href="../../../../../helper/common/xml/Fpga.xml#getTemperature"/>
			<xinclude:include href="../../../../../helper/common/xml/Fpga.xml#modify"/>
		</Device>
	</Board>
</TestInterface>
