<?xml version="1.0"?>
<!DOCTYPE TestInterface SYSTEM "../../../../../shared/dtd/Tif.dtd">
<TestInterface version="1.0">
	<Board name="Helper">
		<Device name="SPI" path="/.spi" comment="Generic SPI interface">
			<xinclude:include href="../../../../../helper/common/xml/SPI.xml#get"/>
			<xinclude:include href="../../../../../helper/common/xml/SPI.xml#set"/>
			<xinclude:include href="../../../../../helper/common/xml/SPI.xml#read"/>
			<xinclude:include href="../../../../../helper/common/xml/SPI.xml#write"/>
			<xinclude:include href="../../../../../helper/common/xml/SPI.xml#lock"/>
			<xinclude:include href="../../../../../helper/common/xml/SPI.xml#unlock"/>
			<xinclude:include href="../../../../../helper/common/xml/SPI.xml#setbus"/>
		</Device>
	</Board>
</TestInterface>
