<?xml version="1.0"?>
<!DOCTYPE TestInterface SYSTEM "../../../../../shared/dtd/Tif.dtd">
<TestInterface version="1.0">
	<Board name="Helper">
		<Device name="Cpri" path="/cpri" comment="CPRI Interface functions">
			<xinclude:include href="../../../../../helper/common/xml/Cpri.xml#NumPorts"/>
			<xinclude:include href="../../../../../helper/common/xml/Cpri.xml#showPort"/>
			<xinclude:include href="../../../../../helper/common/xml/Cpri.xml#showCtl"/>
			<xinclude:include href="../../../../../helper/common/xml/Cpri.xml#showAll"/>
			<xinclude:include href="../../../../../helper/common/xml/Cpri.xml#set"/>
			<xinclude:include href="../../../../../helper/common/xml/Cpri.xml#get"/>
		</Device>
	</Board>
</TestInterface>
